Bio,Following Count,Followers Count,Location,Website,Profile_Link
"Providing Entertainment & Travel to Commercial Radio. Reaching 28.9M weekly listeners. Winners of The Arqiva National Sales Team of the Year 2010, 2011 & 2016",446,125,"London, England",https://t.co/aJKvkwp2dG,https://twitter.com/GTNUK1
message privately with WhatsApp,5,5.5M,California,https://t.co/ku2ShnylHa,https://twitter.com/whatsapp
Customs Broker,124,36,"Florida, USA",N/A,https://twitter.com/aacb_CBPTrade
A & A Freight | Warehousing | Customs Brokerage | Helping people ship across borders.,"3,806",650,Worldwide,http://t.co/laZo1M99c7,https://twitter.com/aacbdotcom
A commercial glass and glazing company serving the window industry in New England since 1954. #SafetyQualityService,88,80,"Malden, MA",https://t.co/UrYUiEDwWi,https://twitter.com/@AAWindowPRODUCT
N/A,N/A,N/A,N/A,N/A,https://www.twitter.com/aandb_kia
"Industry leader in wholesale home decor, furniture, and garden, since 1993.",176,362,"Rancho Cucamonga, CA",https://t.co/2lx3XxMZio,https://twitter.com/ABHomeInc
"From large format black & white prints to the most sophisticated of digital color printing jobs, A & B can get the job done right.",123,131,"Bentonville, AR",http://t.co/zyISURRqvP,https://twitter.com/Abrepro
"A & G Insurance prides itself on being your local, full service, Independent Insurance Agency.",255,42,Connecticut,http://t.co/qDF7dVozxt,https://twitter.com/AGInsuranceLLC
"A & C CHRISTOFI LTD is a fast growing professional services company based in Limassol, Cyprus. Our main Concern is your Business.",290,89,Cyprus,https://t.co/msJpvYtuAt,https://twitter.com/ACChristofiLtd
Used Clothing Distributor,0,17,Carteret,https://t.co/sIZNy1TeMH,https://twitter.com/aeclothing1
"Create, manage and grow your business online with Wix. It’s more than just a website builder, it’s how your vision comes to life. For support: @WixHelp.","3,674",413.5K,We're everywhere!,https://t.co/vzQPGJokOE,http://www.twitter.com/wix
N/A,1,36,"Boulder, CO USA",http://t.co/eMS6qX752b,https://twitter.com/AETechnologies1
